{
  "schema_version": 1,
  "message_id": "RES-0001",
  "message_type": "RESULT",
  "project_id": "PRJ-APF-0001",
  "task_id": "TASK-0001",
  "run_id": "RUN-0001",
  "correlation_id": "TASK-0001",
  "causation_id": "WO-0001",
  "created_at": "2026-08-28T21:35:00Z",
  "actor": {
    "role": "executor",
    "agent_instance": "codex-local-0001",
    "authority": "PROVIDER",
    "provider": "codex_cli",
    "model": "gpt-5.6-luna",
    "effort": "low"
  },
  "policy_snapshot_id": "POL-0001",
  "context": {
    "pack_hash": "sha256:bbbbbbbbbbbbbbbbbbbbbbbbbbbbbbbbbbbbbbbbbbbbbbbbbbbbbbbbbbbbbbbb",
    "refs": ["REQ-0001", "DEC-0002"]
  },
  "payload": {
    "outcome": "SUCCEEDED",
    "summary": "The schema, FTS query, append-only journal and backup restore passed.",
    "changes": [],
    "checks": [
      {
        "name": "foundation-validation",
        "status": "PASSED",
        "evidence_ref": "EVD-LOCAL-0001",
        "summary": "The deterministic foundation validation completed successfully."
      }
    ],
    "artifacts": [],
    "risks": [],
    "assumptions": [],
    "blockers": [],
    "usage": {
      "input_tokens": 0,
      "output_tokens": 0,
      "cost": 0,
      "currency": "USD",
      "duration_ms": 0,
      "state": "ACTUAL",
      "cost_basis": "NONE",
      "source": "local deterministic validation",
      "confidence": "HIGH"
    },
    "next_action": "Proceed to the provider capability gate."
  }
}
