{
  "schema_version": 1,
  "message_id": "WO-0001",
  "message_type": "WORK_ORDER",
  "project_id": "PRJ-APF-0001",
  "task_id": "TASK-0001",
  "correlation_id": "TASK-0001",
  "created_at": "2026-08-28T21:30:00Z",
  "idempotency_key": "sha256:aaaaaaaaaaaaaaaaaaaaaaaaaaaaaaaaaaaaaaaaaaaaaaaaaaaaaaaaaaaaaaaa",
  "actor": {
    "role": "central_orchestrator",
    "agent_instance": "core-local",
    "authority": "CORE"
  },
  "policy_snapshot_id": "POL-0001",
  "budget": {
    "tokens": 20000,
    "cost": 2.0,
    "currency": "USD",
    "duration_seconds": 900,
    "tool_calls": 100,
    "subagents": 0,
    "enforcement": "SOFT"
  },
  "context": {
    "pack_hash": "sha256:bbbbbbbbbbbbbbbbbbbbbbbbbbbbbbbbbbbbbbbbbbbbbbbbbbbbbbbbbbbbbbbb",
    "refs": ["REQ-0001", "DEC-0002"]
  },
  "payload": {
    "objective": "Validate the Project Brain schema without changing product code.",
    "acceptance": [
      "Schema applies to an empty SQLite database",
      "FTS query returns the seeded decision",
      "Audit events reject UPDATE and DELETE"
    ],
    "allowed_paths": ["spec/project-brain/**", "scripts/validate-foundation.ps1"],
    "protected_paths": ["LICENSE", ".git/**", ".apf/**", ".tools/**"],
    "grants": [
      {
        "capability": "filesystem",
        "decision": "ALLOW",
        "enforcement": "APF_VERIFIED",
        "scope": {
          "paths": ["spec/project-brain/**", "scripts/validate-foundation.ps1"],
          "environment": "LOCAL",
          "expires_at": "2026-08-28T22:00:00Z"
        }
      },
      {
        "capability": "network",
        "decision": "DENY",
        "enforcement": "ADVISORY",
        "scope": { "environment": "LOCAL" }
      }
    ],
    "provider_profile": "economy",
    "expected_response_schema": "urn:apf:spec:apf-cp:v1:message#/$defs/result",
    "max_attempts": 1
  }
}
